<?xml version="1.0" encoding="UTF-8" standalone="yes"?>
<!--
*******************************************************************************
* JMMC project ( http://www.jmmc.fr ) - Copyright (C) CNRS.
*******************************************************************************
-->

<!--
  This file describes a set of plotdefinition to be used has plot configuration presets 
-->
<p:plotDefinitions
    xmlns:xsi='http://www.w3.org/2001/XMLSchema-instance'
    xmlns:p='http://www.jmmc.fr/oiexplorer-core-plot-definition/0.1'
    xsi:schemaLocation='http://www.jmmc.fr/oiexplorer-core-plot-definition/0.1 ../model/PlotDefinition.xsd'>
    
   
    <!-- Changes to this file should get ATTENTION                                        -->           
    <!-- first OIfitsExplorer versions may store plotDefinition with the historical names -->
    <!-- Ids should be added to replace name (and accept whole characters...)             -->

    <!-- plot spatial(UCOORD VCOORD) -->    
    <plotDefinition>
        <id>VCOORD_SPATIAL/UCOORD_SPATIAL</id>
        <name>Spatial UCOORD - VCOORD coverage</name>
        <skipFlaggedData>true</skipFlaggedData>
        <drawLine>false</drawLine>
        <xAxis>
            <name>UCOORD_SPATIAL</name>
            <logScale>false</logScale>
            <includeZero>true</includeZero>
            <converter>MEGA_LAMBDA</converter>
        </xAxis>
        <yAxes>
            <name>VCOORD_SPATIAL</name>
            <logScale>false</logScale>
            <includeZero>true</includeZero>
            <converter>MEGA_LAMBDA</converter>
        </yAxes>
    </plotDefinition>




    <!-- plot (Vis2 / T3phi) vs spatial freq -->    
    <plotDefinition>
        <id>VIS2DATA_T3PHI/SPATIAL_FREQ</id>
        <name>Vis2Data and T3Phi vs. Spatial freq.</name>
        <skipFlaggedData>true</skipFlaggedData>
        <drawLine>false</drawLine>
        <xAxis>
            <name>SPATIAL_FREQ</name>
            <logScale>false</logScale>
            <includeZero>true</includeZero>
            <converter>MEGA_LAMBDA</converter>
        </xAxis>
        <yAxes>
            <name>VIS2DATA</name>
            <logScale>false</logScale>
            <includeZero>false</includeZero>
        </yAxes>
        <yAxes>
            <name>T3PHI</name>
            <logScale>false</logScale>
            <includeZero>false</includeZero>
        </yAxes> 
    </plotDefinition>
    
    <!-- plot (Vis2 / T3phi) vs radius -->    
    <plotDefinition>
        <id>VIS2DATA_T3PHI/RADIUS</id>
        <name>Vis2Data and T3Phi vs. Radius</name>
        <skipFlaggedData>true</skipFlaggedData>
        <drawLine>false</drawLine>
        <xAxis>
            <name>RADIUS</name>
            <logScale>false</logScale>
            <includeZero>true</includeZero>
        </xAxis>
        <yAxes>
            <name>VIS2DATA</name>
            <logScale>false</logScale>
            <includeZero>false</includeZero>
        </yAxes>
        <yAxes>
            <name>T3PHI</name>
            <logScale>false</logScale>
            <includeZero>false</includeZero>
        </yAxes> 
    </plotDefinition>
    
    <!-- plot (Vis2 / T3phi) vs angle -->    
    <plotDefinition>
        <id>VIS2DATA_T3PHI/POS_ANGLE</id>
        <name>Vis2Data and T3Phi vs. Pos. angle</name>
        <skipFlaggedData>true</skipFlaggedData>
        <drawLine>false</drawLine>
        <xAxis>
            <name>POS_ANGLE</name>
            <logScale>false</logScale>
            <includeZero>false</includeZero>
        </xAxis>
        <yAxes>
            <name>VIS2DATA</name>
            <logScale>false</logScale>
            <includeZero>false</includeZero>
        </yAxes>
        <yAxes>
            <name>T3PHI</name>
            <logScale>false</logScale>
            <includeZero>false</includeZero>
        </yAxes> 
    </plotDefinition>
    
    <!-- plot(Vis2 - T3) vs wavelength -->    
    <plotDefinition>
        <id>VIS2DATA_T3PHI/EFF_WAVE</id>
        <name>Vis2Data and T3Phi vs. Eff. Wave</name>
        <skipFlaggedData>true</skipFlaggedData>
        <drawLine>false</drawLine>
        <xAxis>
            <name>EFF_WAVE</name>
            <logScale>false</logScale>
            <includeZero>false</includeZero>
            <converter>MICRO_METER</converter>
        </xAxis>
        <yAxes>
            <name>VIS2DATA</name>
            <logScale>false</logScale>
            <includeZero>false</includeZero>
        </yAxes>
        <yAxes>
            <name>T3PHI</name>
            <logScale>false</logScale>
            <includeZero>false</includeZero>
        </yAxes> 
    </plotDefinition>
    
    <!-- plot(Vis2 - T3) vs hour angle -->
    <plotDefinition>
        <id>VIS2DATA_T3PHI/HOUR_ANGLE</id>
        <name>Vis2Data and T3Phi vs. Hour angle</name>
        <skipFlaggedData>true</skipFlaggedData>
        <drawLine>false</drawLine>
        <xAxis>
            <name>HOUR_ANGLE</name>
            <logScale>false</logScale>
            <includeZero>true</includeZero>
        </xAxis>
        <yAxes>
            <name>VIS2DATA</name>
            <logScale>false</logScale>
            <includeZero>false</includeZero>
        </yAxes>
        <yAxes>
            <name>T3PHI</name>
            <logScale>false</logScale>
            <includeZero>false</includeZero>
        </yAxes> 
    </plotDefinition>




    <!-- plot (Vis2 / VisAmp) vs spatial freq -->    
    <plotDefinition>
        <id>VIS2DATA_VISAMP/SPATIAL_FREQ</id>
        <name>Vis2Data and VisAmp vs. Spatial freq.</name>
        <skipFlaggedData>true</skipFlaggedData>
        <drawLine>false</drawLine>
        <xAxis>
            <name>SPATIAL_FREQ</name>
            <logScale>false</logScale>
            <includeZero>true</includeZero>
            <converter>MEGA_LAMBDA</converter>
        </xAxis>
        <yAxes>
            <name>VIS2DATA</name>
            <logScale>false</logScale>
            <includeZero>false</includeZero>
        </yAxes>
        <yAxes>
            <name>VISAMP</name>
            <logScale>false</logScale>
            <includeZero>false</includeZero>
        </yAxes> 
    </plotDefinition>
    
    <!-- plot (Vis2 / VisAmp) vs radius -->    
    <plotDefinition>
        <id>VIS2DATA_VISAMP/RADIUS</id>
        <name>Vis2Data and VisAmp vs. Radius</name>
        <skipFlaggedData>true</skipFlaggedData>
        <drawLine>false</drawLine>
        <xAxis>
            <name>RADIUS</name>
            <logScale>false</logScale>
            <includeZero>true</includeZero>
        </xAxis>
        <yAxes>
            <name>VIS2DATA</name>
            <logScale>false</logScale>
            <includeZero>false</includeZero>
        </yAxes>
        <yAxes>
            <name>VISAMP</name>
            <logScale>false</logScale>
            <includeZero>false</includeZero>
        </yAxes> 
    </plotDefinition>
    
    <!-- plot (Vis2 / VisAmp) vs angle -->    
    <plotDefinition>
        <id>VIS2DATA_VISAMP/POS_ANGLE</id>
        <name>Vis2Data and VisAmp vs. Pos. angle</name>
        <skipFlaggedData>true</skipFlaggedData>
        <drawLine>false</drawLine>
        <xAxis>
            <name>POS_ANGLE</name>
            <logScale>false</logScale>
            <includeZero>false</includeZero>
        </xAxis>
        <yAxes>
            <name>VIS2DATA</name>
            <logScale>false</logScale>
            <includeZero>false</includeZero>
        </yAxes>
        <yAxes>
            <name>VISAMP</name>
            <logScale>false</logScale>
            <includeZero>false</includeZero>
        </yAxes> 
    </plotDefinition>
    
    <!-- plot(Vis2 / VisAmp) vs wavelength -->    
    <plotDefinition>
        <id>VIS2DATA_VISAMP/EFF_WAVE</id>
        <name>Vis2Data and VisAmp vs. Eff. Wave</name>
        <skipFlaggedData>true</skipFlaggedData>
        <drawLine>false</drawLine>
        <xAxis>
            <name>EFF_WAVE</name>
            <logScale>false</logScale>
            <includeZero>false</includeZero>
            <converter>MICRO_METER</converter>
        </xAxis>
        <yAxes>
            <name>VIS2DATA</name>
            <logScale>false</logScale>
            <includeZero>false</includeZero>
        </yAxes>
        <yAxes>
            <name>VISAMP</name>
            <logScale>false</logScale>
            <includeZero>false</includeZero>
        </yAxes> 
    </plotDefinition>
    
    <!-- plot(Vis2 / VisAmp) vs hour angle -->
    <plotDefinition>
        <id>VIS2DATA_VISAMP/HOUR_ANGLE</id>
        <name>Vis2Data and VisAmp vs. Hour angle</name>
        <skipFlaggedData>true</skipFlaggedData>
        <drawLine>false</drawLine>
        <xAxis>
            <name>HOUR_ANGLE</name>
            <logScale>false</logScale>
            <includeZero>true</includeZero>
        </xAxis>
        <yAxes>
            <name>VIS2DATA</name>
            <logScale>false</logScale>
            <includeZero>false</includeZero>
        </yAxes>
        <yAxes>
            <name>VISAMP</name>
            <logScale>false</logScale>
            <includeZero>false</includeZero>
        </yAxes> 
    </plotDefinition>


        
                        
    <!-- plot (VisAmp - VisPhi) vs spatial freq -->    
    <plotDefinition>
        <id>VISAMP_VISPHI/SPATIAL_FREQ</id>
        <name>VisAmp and VisPhi vs. Spatial freq.</name>
        <skipFlaggedData>true</skipFlaggedData>
        <drawLine>false</drawLine>
        <xAxis>
            <name>SPATIAL_FREQ</name>
            <logScale>false</logScale>
            <includeZero>true</includeZero>
            <converter>MEGA_LAMBDA</converter>
        </xAxis>
        <yAxes>
            <name>VISAMP</name>
            <logScale>false</logScale>
            <includeZero>false</includeZero>
        </yAxes>
        <yAxes>
            <name>VISPHI</name>
            <logScale>false</logScale>
            <includeZero>false</includeZero>
        </yAxes> 
    </plotDefinition>

    <!-- plot(VisAmp - VisPhi) vs wavelength -->    
    <plotDefinition>